{
  "theme": "banodoco-default",
  "theme_overrides": {"visual": {"canvas": {"fps": 30}}},
  "tracks": [{"id": "v1", "kind": "visual", "label": "V1"}],
  "clips": [
    {"id": "subframe", "at": 0.016, "hold": 0.016, "track": "v1"},
    {
      "id": "half_ties",
      "at": 0.016666666666666666,
      "hold": 0.08333333333333333,
      "track": "v1"
    }
  ]
}
