{
  "theme": "banodoco-default",
  "theme_overrides": {"visual": {"canvas": {"fps": 30}}},
  "tracks": [
    {"id": "v1", "kind": "visual", "label": "Top"},
    {"id": "v2", "kind": "visual", "label": "Bottom"}
  ],
  "clips": [
    {"id": "bottom", "at": 0, "hold": 10, "track": "v2"},
    {"id": "top", "at": 0, "hold": 10, "track": "v1"}
  ]
}
