{
  "app": {
    "com.example.writer2": {
      "note": "concurrent write"
    },
    "com.reigh.scene-phase-markers": {
      "sceneMarkers": []
    }
  },
  "clips": [
    {
      "asset": "plant-frame-1",
      "at": 0.6667,
      "clipType": "media",
      "generation": {
        "input_index": 0,
        "role": "storyboard-input"
      },
      "hold": 2.9333,
      "id": "plant-frame-1",
      "track": "storyboard"
    },
    {
      "asset": "plant-frame-2",
      "at": 3.6,
      "clipType": "media",
      "generation": {
        "input_index": 1,
        "role": "storyboard-input"
      },
      "hold": 4.9667,
      "id": "plant-frame-2",
      "track": "storyboard"
    },
    {
      "asset": "plant-frame-3",
      "at": 8.5667,
      "clipType": "media",
      "generation": {
        "input_index": 2,
        "role": "storyboard-input"
      },
      "hold": 2.8666,
      "id": "plant-frame-3",
      "track": "storyboard"
    },
    {
      "asset": "plant-frame-4",
      "at": 11.4333,
      "clipType": "media",
      "generation": {
        "input_index": 3,
        "role": "storyboard-input"
      },
      "hold": 2.4334,
      "id": "plant-frame-4",
      "track": "storyboard"
    },
    {
      "asset": "toccata-fugue",
      "at": 0.5,
      "clipType": "media",
      "hold": 97.5,
      "id": "toccata-fugue",
      "track": "4a47c8fd-2287-4808-89b0-73f956a66eac"
    }
  ],
  "theme": "banodoco-default",
  "theme_overrides": {
    "visual": {
      "canvas": {
        "fps": 24,
        "height": 720,
        "width": 1280
      }
    }
  },
  "tracks": [
    {
      "app": {
        "scaleAppliesToPositionedClips": true
      },
      "fit": "cover",
      "id": "storyboard",
      "kind": "visual",
      "label": "Storyboard"
    },
    {
      "app": {
        "scaleAppliesToPositionedClips": true
      },
      "id": "4a47c8fd-2287-4808-89b0-73f956a66eac",
      "kind": "audio",
      "label": "Music"
    }
  ]
}
