{
  "theme": "banodoco-default",
  "theme_overrides": {"visual": {"canvas": {"fps": 30}}},
  "tracks": [
    {"id": "explicit", "kind": "visual", "label": "Explicit Frames"},
    {"id": "seconds", "kind": "visual", "label": "Duration Seconds"},
    {"id": "registered", "kind": "visual", "label": "Registered Default"},
    {"id": "fallback", "kind": "visual", "label": "Hard Fallback"},
    {"id": "bounds", "kind": "visual", "label": "Invalid Bounds"},
    {"id": "gap", "kind": "visual", "label": "No Overlap"},
    {"id": "effect_from", "kind": "visual", "label": "Effect From"},
    {"id": "effect_to", "kind": "visual", "label": "Effect To"}
  ],
  "clips": [
    {
      "id": "explicit_from",
      "at": 0,
      "hold": 3,
      "clipType": "media",
      "track": "explicit",
      "transition": {"id": "cross-fade", "durationFrames": 15, "duration": 0.4}
    },
    {"id": "explicit_to", "at": 2, "hold": 3, "clipType": "media", "track": "explicit"},
    {
      "id": "seconds_from",
      "at": 0,
      "hold": 3,
      "clipType": "media",
      "track": "seconds",
      "transition": {"id": "cross-fade", "duration": 0.4}
    },
    {"id": "seconds_to", "at": 2, "hold": 3, "clipType": "media", "track": "seconds"},
    {
      "id": "registered_from",
      "at": 0,
      "hold": 3,
      "clipType": "media",
      "track": "registered",
      "transition": {"id": "cross-fade"}
    },
    {"id": "registered_to", "at": 2, "hold": 3, "clipType": "media", "track": "registered"},
    {
      "id": "fallback_from",
      "at": 0,
      "hold": 3,
      "clipType": "media",
      "track": "fallback",
      "transition": {"id": "cross-fade"}
    },
    {"id": "fallback_to", "at": 2, "hold": 3, "clipType": "media", "track": "fallback"},
    {
      "id": "bounds_from",
      "at": 0,
      "hold": 3,
      "clipType": "media",
      "track": "bounds",
      "transition": {"id": "cross-fade", "durationFrames": 91}
    },
    {"id": "bounds_to", "at": 2, "hold": 3, "clipType": "media", "track": "bounds"},
    {
      "id": "gap_from",
      "at": 0,
      "hold": 1,
      "clipType": "media",
      "track": "gap",
      "transition": {"id": "cross-fade", "durationFrames": 8}
    },
    {"id": "gap_to", "at": 2, "hold": 1, "clipType": "media", "track": "gap"},
    {
      "id": "effect_layer_from",
      "at": 0,
      "hold": 3,
      "clipType": "effect-layer",
      "generation": {"prompt": "Prompted title card"},
      "track": "effect_from",
      "transition": {"id": "cross-fade", "durationFrames": 8}
    },
    {"id": "effect_from_to", "at": 2, "hold": 3, "clipType": "media", "track": "effect_from"},
    {
      "id": "effect_to_from",
      "at": 0,
      "hold": 3,
      "clipType": "media",
      "track": "effect_to",
      "transition": {"id": "cross-fade", "durationFrames": 8}
    },
    {
      "id": "effect_layer_to",
      "at": 2,
      "hold": 3,
      "clipType": "effect-layer",
      "generation": {"prompt": "Second prompted title card"},
      "track": "effect_to"
    }
  ]
}
