{
  "theme": "banodoco-default",
  "theme_overrides": {"visual": {"canvas": {"fps": 30}}},
  "tracks": [
    {"id": "v1", "kind": "visual", "label": "V1"},
    {"id": "a1", "kind": "audio", "label": "A1"}
  ],
  "clips": [
    {"id": "img", "at": 0, "hold": 5, "track": "v1"},
    {"id": "snd", "at": 0, "hold": 20, "track": "a1"}
  ]
}
